{
  "felles": {
    "søkerNavn": "Dolly Duck",
    "søkerPersonnummer": "300220 12345",
    "brevDato": "4. mai 2021",
    "erAutomatiskBehandlet": true,
    "saksnummer": "123456789",
    "behandlesAvKA": false,
    "erUtkast": false
  },
  "årsak": "1023",
  "erSøkerDød": false,
  "stønadsdatoFom": "1. april 2021",
  "mottattDato": "23. mars 2021",
  "antallArbeidsgivere": 2,
  "halvG": 50000,
  "lovhjemmel":"§ 14-4",
  "klagefristUker": 6
}